{
  "asset_id": "A1",
  "project_id": "EXAMPLE-FRIDGE-001",
  "scene_id": "S1",
  "asset_role": "anchor",
  "status": "approved",
  "entity_ids": [
    "fridge_01"
  ],
  "parent_asset_ids": [],
  "attempt": 0,
  "provenance": {
    "provider_id": "manual-chatgpt-image",
    "provider_mode": "manual",
    "operation": "generate_anchor",
    "source_uri": null,
    "prompt_snapshot": "See anchor-provider-job.json",
    "notes": "Synthetic approved manifest for workflow demonstration; actual binary image is not stored in this repository."
  },
  "file": {
    "uri": "assets/A1.png",
    "mime_type": "image/png",
    "width": 1080,
    "height": 1920,
    "checksum": null
  },
  "qa_result_ids": [
    "QA-VIS-A1"
  ]
}